{
  "score_id": "READINESS-SCORE-EXAMPLE-001",
  "device_or_platform_id": "SILICON-SPIN-UNITCELL-PLACEHOLDER-001",
  "target_protocol": "surface-code-adjacent readiness placeholder",
  "axis_scores": {
    "control_fidelity_score": 0.82,
    "spam_readout_score": 0.78,
    "coherence_stability_score": 0.70,
    "error_provenance_score": 0.76,
    "calibration_repeatability_score": 0.68,
    "yield_variation_score": 0.64,
    "connectivity_score": 0.55,
    "thermal_control_scalability_score": 0.62,
    "evidence_maturity_score": 0.80
  },
  "weights": {
    "control_fidelity_score": 0.18,
    "spam_readout_score": 0.12,
    "coherence_stability_score": 0.12,
    "error_provenance_score": 0.14,
    "calibration_repeatability_score": 0.12,
    "yield_variation_score": 0.10,
    "connectivity_score": 0.08,
    "thermal_control_scalability_score": 0.08,
    "evidence_maturity_score": 0.06
  },
  "weighted_score": 0.719,
  "readiness_band": "prototype-ready evidence",
  "claim_boundary": "Illustrative score only; production score requires device-level measurements and target-code-specific assumptions.",
  "evidence_links": ["AQLEN-EA-001", "AQLEN-EA-002", "AQLEN-EA-003", "AQLEN-EA-005"]
}
